<?xml version="1.0" encoding="UTF-8"?>
<PRODUCT_RECIPE version="1.000000" xmlns:xsi="http://www.w3.org/2001/XMLSchema-instance"
 xsi:noNamespaceSchemaLocation="http://suppliespackaging.hp.com/XMLschema/PamaCFG.xsd">
<ASSEMBLY_NUMBER>3YP03BL</ASSEMBLY_NUMBER>
<INSTALLBY_DATE_OFFSET>18</INSTALLBY_DATE_OFFSET>
<FILE_CREATED_DATE>2006-01-09T09:15:37Z</FILE_CREATED_DATE>
<COMPONENT COMPONENT_CLASS="NOT VALID">
<LAST_UPDATED>2006-01-09T09:15:37Z</LAST_UPDATED>
<DATA_SOURCE Currently_Selected="STATIC">
<STATIC></STATIC>
<REMOTELY_MANAGED FailureCount="0">
<CONFIGURATION></CONFIGURATION>
</REMOTELY_MANAGED>
<LOCALLY_MANAGED FailureCount="0">
<DB_TABLENAME></DB_TABLENAME>
<DB_DATA_COLUMN_NAME></DB_DATA_COLUMN_NAME>
<DB_WHERE_STATEMENT></DB_WHERE_STATEMENT>
</LOCALLY_MANAGED>
<ADO FailureCount="0">
<CONNECTION_STRING></CONNECTION_STRING>
<COMMAND_STRING></COMMAND_STRING>
</ADO>
</DATA_SOURCE>
<ATTRIBUTES SEQUENCE_NUMBER="0" UNITS="PICA POUCH">
<CREATION_DATE>2006-01-09T09:15:37Z</CREATION_DATE>
<DATA></DATA>
</ATTRIBUTES>
<ATTRIBUTES SEQUENCE_NUMBER="1" UNITS="WO REQUIRED">
<CREATION_DATE>2006-01-09T09:15:37Z</CREATION_DATE>
<DATA>NOT REQUIRED</DATA>
</ATTRIBUTES>
<ATTRIBUTES SEQUENCE_NUMBER="2" UNITS="WORK ORDER">
<CREATION_DATE>2006-01-09T09:15:37Z</CREATION_DATE>
<DATA>001000522322</DATA>
</ATTRIBUTES>
</COMPONENT>
</PRODUCT_RECIPE>