<?xml version="1.0" encoding="UTF-8" standalone="yes"?><PRODUCT_RECIPE version="1.0" xmlns:xsi="http://www.w3.org/2001/XMLSchema-instance" xsi:noNamespaceSchemaLocation="http://suppliespackaging.hp.com/XMLschema/PamaCFG.xsd">
<ASSEMBLY_NUMBER>XXXXXX-XXX</ASSEMBLY_NUMBER>
<INSTALLBY_DATE_OFFSET>18</INSTALLBY_DATE_OFFSET>
<FILE_CREATED_DATE>2004-09-21T05:03:25Z</FILE_CREATED_DATE>
<COMPONENT COMPONENT_CLASS="PRIMARY ASSEMBLY (BULK)">
<LAST_UPDATED>2005-06-12T19:13:44Z</LAST_UPDATED>
<DATA_SOURCE Currently_Selected="STATIC"/>
<ATTRIBUTES SEQUENCE_NUMBER="0" UNITS="PICA">
<CREATION_DATE>2005-06-12T19:13:44Z</CREATION_DATE>
<DATA>HP</DATA>
</ATTRIBUTES>
</COMPONENT>
</PRODUCT_RECIPE>
